id_geral,id_dodf_rel,tipo_rel,estado_rel,texto,anotacoes,x_tsne,y_tsne,x_umap,y_umap
13212101020137899,13_212.10.10.2013R78,Ato_Exoneracao_Comissionado,nao_confirmado,"EXONERAR, a pedido, AMANDA RACHEL MONTEIRO KRAUZ do Cargo em Comissao, 
Simbolo DFG-12, de Chefe, do Nucleo de Licenciamento de Obras, da Gerencia de Exame, 
Aprovacao e Elaboracao de Projetos, da Diretoria de Servicos, da Administracao Regional da 
Ceilandia, da Coordenadoria das Cidades, da Casa Civil, da Governadoria do Distrito Federal, 
contar de 03 de outubro de 2013.","['132121010201378100', '13212101020137899', '132121010201378101', '132121010201378102', '132121010201378103', '132121010201378107', '132121010201378112346', '132121010201378112347']",0.98256695,-4.468455,0.012556097,2.0693443
